{
    "$schema": "http://json-schema.org/draft-06/schema#",
    "$ref": "#/definitions/BirthCertificate",
    "definitions": {
        "BirthCertificate": {
            "type": "object",
            "additionalProperties": false,
            "properties": {
                "id": {
                    "type": "string"
                },
                "type": {
                    "type": "string"
                },
                "givenName": {
                    "type": "string"
                },
                "familyName": {
                    "type": "string"
                },
                "citizenship": {
                    "type": "string"
                },
                "birthDate": {
                    "type": "string",
                    "format": "date-time"
                },
                "birthPlace": {
                    "$ref": "#/definitions/BirthPlace"
                },
                "parent": {
                    "type": "array",
                    "items": {
                        "$ref": "#/definitions/Parent"
                    }
                }
            },
            "required": [
                "birthDate",
                "birthPlace",
                "citizenship",
                "familyName",
                "givenName",
                "id",
                "parent",
                "type"
            ],
            "title": "BirthCertificate"
        },
        "BirthPlace": {
            "type": "object",
            "additionalProperties": false,
            "properties": {
                "type": {
                    "type": "string"
                },
                "address": {
                    "$ref": "#/definitions/Address"
                }
            },
            "required": [
                "address",
                "type"
            ],
            "title": "BirthPlace"
        },
        "Address": {
            "type": "object",
            "additionalProperties": false,
            "properties": {
                "type": {
                    "type": "string"
                },
                "addressLocality": {
                    "type": "string"
                },
                "addressRegion": {
                    "type": "string"
                },
                "postalCode": {
                    "type": "string",
                    "format": "integer"
                },
                "streetAddress": {
                    "type": "string"
                }
            },
            "required": [
                "addressLocality",
                "addressRegion",
                "postalCode",
                "streetAddress",
                "type"
            ],
            "title": "Address"
        },
        "Parent": {
            "type": "object",
            "additionalProperties": false,
            "properties": {
                "id": {
                    "type": "string"
                },
                "type": {
                    "type": "string"
                },
                "givenName": {
                    "type": "string"
                },
                "familyName": {
                    "type": "string"
                },
                "maidenName": {
                    "type": "string"
                }
            },
            "required": [
                "familyName",
                "givenName",
                "id",
                "type"
            ],
            "title": "Parent"
        }
    }
}
