{
  "id": "did:example:8vFBbPrhBUyG6DEzVncBZpzBNsmRrbfsQKXQKPLskBCu",
  "type": "Person",
  "givenName": "Anand",
  "familyName": "Hamal",
  "citizenship": "US",
  "birthDate": "2017-10-01T00:00:00Z",
  "birthPlace": {
    "type": "Hospital",
    "address": {
      "type": "US address",
      "addressLocality": "Denver",
      "addressRegion": "CO",
      "postalCode": "80209",
      "streetAddress": "123 Main St."
    }
  },
  "parent": [{
    "id": "did:example:BcRisGnqV4QPb6bRmDCqEjyuubBarS1Y1nhDwxBMTXY4",
    "type": "Person",
    "givenName": "Malathi",
    "familyName": "Hamal",
    "maidenName": "Holla"
  }, {
    "id": "did:example:BgXRjB4RPrrsUVoVNaYNwzfznKsWep7AWrZkiyVcorEN",
    "type": "Person",
    "givenName": "Rajesh",
    "familyName": "Hamal"
  }]
}